"uniqueID","mediaTitle","category","year","countryOrigin","genre","peopleScore","criticScore","tconst","parentTitle"
"sqs101800050m4","A Dozen Red Roses (S01, Ep19)","Television",2008,"USA","Drama",8.1,4.1,NA,"The Mentalist"
"sqs101800053m4","Blood Brothers (S01, Ep22)","Television",2008,"USA","Drama",8.1,4.1,NA,"The Mentalist"
"sqs101800054m4","Red John's Footsteps (S01, Ep23)","Television",2008,"USA","Drama",8.1,4.1,NA,"The Mentalist"
"sqs101800059m4","Robbin' Season: Alligator Man (Ep1)","Television",2018,"USA","Comedy",8.5,4.3,NA,"Atlanta S02"
"sqs101800210m4","Spark of Civilization (Ep1)","Television",2017,"USA","History",6.8,3.4,NA,"Origins: The Journey of Humankind"
"sqs101800211m4","Cheating Death (Ep2)","Television",2017,"USA","History",6.8,3.4,NA,"Origins: The Journey of Humankind"
"sqs101800212m4","Power of Money (Ep3)","Television",2017,"USA","History",6.8,3.4,NA,"Origins: The Journey of Humankind"
"sqs101800005m4","Which Side Are You On? (S01, Ep6)","Television",2018,"USA","Drama",6.9,3.5,NA,"Succession"
"sqs101800006m4","Austerlitz (S01, Ep7)","Television",2018,"USA","Drama",6.9,3.5,NA,"Succession"
"sqs101800007m4","Prague (S01, Ep8)","Television",2018,"USA","Drama",6.9,3.5,NA,"Succession"
"sqs101800008m4","Pre-Nuptial (S01, Ep9)","Television",2018,"USA","Drama",6.9,3.5,NA,"Succession"
"sqs101800009m4","Nobody Is Ever Missing (S01, Ep10)","Television",2018,"USA","Drama",6.9,3.5,NA,"Succession"
"sqs101800055m4","Santa, Schmanta (Ep1)","Television",2018,"USA","Animation",7.5,3.8,NA,"American Dad! S14"
"sqs101800056m4","Paranoid_Frandroid (Ep2)","Television",2018,"USA","Animation",7.5,3.8,NA,"American Dad! S14"
"sqs101800057m4","The Census of the Lambs (Ep3)","Television",2018,"USA","Animation",7.5,3.8,NA,"American Dad! S14"
"sqs101800058m4","Shell Game (Ep4)","Television",2018,"USA","Animation",7.5,3.8,NA,"American Dad! S14"
"sqs101800070m4","Captain Latvia (Ep10)","Television",2016,"USA","Comedy",8.3,4.2,NA,"Brooklyn Nine-Nine S04"
"sqs101800071m4","The Fugitive, Part 1 (Ep11)","Television",2016,"USA","Comedy",8.3,4.2,NA,"Brooklyn Nine-Nine S04"
"sqs101800072m4","The Fugitive, Part 2 (Ep12)","Television",2016,"USA","Comedy",8.3,4.2,NA,"Brooklyn Nine-Nine S04"
"sqs101800073m4","B as in Best Friends (Ep1)","Television",2017,"USA","Comedy",8,4,NA,"Fresh Off the Boat S04"
"sqs101800074m4","First Day (Ep2)","Television",2017,"USA","Comedy",8,4,NA,"Fresh Off the Boat S04"
"sqs101800075m4","Kids (Ep3)","Television",2017,"USA","Comedy",8,4,NA,"Fresh Off the Boat S04"
"sqs101800076m4","It's a Plastic Pumpkin, Louis Huang (Ep4)","Television",2017,"USA","Comedy",8,4,NA,"Fresh Off the Boat S04"
"sqs101800077m4","Ep 1 Gags","Television",2017,"CAN","Comedy",6.5,3.3,NA,"Just for Laughs: Gags S17"
"sqs101800078m4","Ep 2 Gags","Television",2017,"CAN","Comedy",6.5,3.3,NA,"Just for Laughs: Gags S17"
"sqs101800079m4","Pilot - Splitting Up Together (S01, Ep1)","Television",2018,"USA","Comedy",6.9,3.5,NA,"Splitting Up Together"
"sqs101800080m4","Devil May Care (S01, Ep2)","Television",2018,"USA","Comedy",6.9,3.5,NA,"Splitting Up Together"
"sqs101800081m4","Street Meat (S01, Ep3)","Television",2018,"USA","Comedy",6.9,3.5,NA,"Splitting Up Together"
"sqs101800082m4","Soups Jealous (S01, Ep4)","Television",2018,"USA","Comedy",6.9,3.5,NA,"Splitting Up Together"
"sqs101800083m4","Nevertheless…She Went Clubbing (S01, Ep5)","Television",2018,"USA","Comedy",6.9,3.5,NA,"Splitting Up Together"
"sqs101800084m4","Letting Ghost (S01, Ep6)","Television",2018,"USA","Comedy",6.9,3.5,NA,"Splitting Up Together"
"sqs101800085m4","Star Of Milo (S01, Ep7)","Television",2018,"USA","Comedy",6.9,3.5,NA,"Splitting Up Together"
"sqs101800086m4","Heat Wave (S01, Ep8)","Television",2018,"USA","Comedy",6.9,3.5,NA,"Splitting Up Together"
"sqs101800087m4","The Wedding (Ep10)","Television",2017,"USA","Comedy",7.2,3.6,NA,"Will & Grace S09"
"sqs101800088m4","Staten Island Fairy (Ep11)","Television",2017,"USA","Comedy",7.2,3.6,NA,"Will & Grace S09"
"sqs101800089m4","Three Wise Men (Ep12)","Television",2017,"USA","Comedy",7.2,3.6,NA,"Will & Grace S09"
"sqs101800090m4","Comeback (S01, Ep1)","Television",2018,"USA","Drama",7.3,3.7,NA,"Absentia"
"sqs101800091m4","Reset (S01, Ep2)","Television",2018,"USA","Drama",7.3,3.7,NA,"Absentia"
"sqs101800092m4","The Emily Show (S01, Ep3)","Television",2018,"USA","Drama",7.3,3.7,NA,"Absentia"
"sqs101800093m4","Me You Him Me (S01, Ep4)","Television",2018,"USA","Drama",7.3,3.7,NA,"Absentia"
"sqs101800094m4","Dig (S01, Ep5)","Television",2018,"USA","Drama",7.3,3.7,NA,"Absentia"
"sqs101800095m4","Nobody's Innocent (S01, Ep6)","Television",2018,"USA","Drama",7.3,3.7,NA,"Absentia"
"sqs101800096m4","A & B (S01, Ep7)","Television",2018,"USA","Drama",7.3,3.7,NA,"Absentia"
"sqs101800097m4","Brave Boy (S01, Ep8)","Television",2018,"USA","Drama",7.3,3.7,NA,"Absentia"
"sqs101800098m4","Child's Play (S01, Ep9)","Television",2018,"USA","Drama",7.3,3.7,NA,"Absentia"
"sqs101800099m4","Original Sin (S01, Ep10)","Television",2018,"USA","Drama",7.3,3.7,NA,"Absentia"
"sqs101800100m4","Old Habits (S01, Ep1)","Television",2018,"GBR","Drama",6.9,3.5,NA,"Deep State"
"sqs101800101m4","A Kind of Warfare (S01, Ep2)","Television",2018,"GBR","Drama",6.9,3.5,NA,"Deep State"
"sqs101800102m4","The Man Came Around (S01, Ep3)","Television",2018,"GBR","Drama",6.9,3.5,NA,"Deep State"
"sqs101800103m4","Reunion (S01, Ep4)","Television",2018,"GBR","Drama",6.9,3.5,NA,"Deep State"
"sqs101800104m4","Merger (S01, Ep5)","Television",2018,"GBR","Drama",6.9,3.5,NA,"Deep State"
"sqs101800105m4","Stories (S01, Ep6)","Television",2018,"GBR","Drama",6.9,3.5,NA,"Deep State"
"sqs101800106m4","White Noise (S01, Ep7)","Television",2018,"GBR","Drama",6.9,3.5,NA,"Deep State"
"sqs101800107m4","Blood in the Sand (S01, Ep8)","Television",2018,"GBR","Drama",6.9,3.5,NA,"Deep State"
"sqs101800108m4","The Flash Reborn (Ep1)","Television",2017,"USA","Drama",8.1,4.1,NA,"The Flash S04"
"sqs101800109m4","Mixed Signals (Ep2)","Television",2017,"USA","Drama",8.1,4.1,NA,"The Flash S04"
"sqs101800110m4","Luck Be A Lady (Ep3)","Television",2017,"USA","Drama",8.1,4.1,NA,"The Flash S04"
"sqs101800111m4","Elongated Journey Into Night (Ep4)","Television",2017,"USA","Drama",8.1,4.1,NA,"The Flash S04"
"sqs101800112m4","Girls Night Out (Ep5)","Television",2017,"USA","Drama",8.1,4.1,NA,"The Flash S04"
"sqs101800113m4","boXed In (S01, Ep5)","Television",2017,"USA","Drama",7.7,3.9,NA,"The Gifted"
"sqs101800114m4","got your siX (S01, Ep6)","Television",2017,"USA","Drama",7.7,3.9,NA,"The Gifted"
"sqs101800115m4","eXtreme measures (S01, Ep7)","Television",2017,"USA","Drama",7.7,3.9,NA,"The Gifted"
"sqs101800116m4","threat of eXtinction (S01, Ep8)","Television",2017,"USA","Drama",7.7,3.9,NA,"The Gifted"
"sqs101800117m4","Despite Yourself (S01, Ep10)","Television",2017,"USA","Drama",7.4,3.7,NA,"Star Trek: Discovery"
"sqs101800118m4","The Wolf Inside (S01, Ep11)","Television",2017,"USA","Drama",7.4,3.7,NA,"Star Trek: Discovery"
"sqs101800119m4","Vaulting Ambition (S01, Ep12)","Television",2017,"USA","Drama",7.4,3.7,NA,"Star Trek: Discovery"
"sqs101800120m4","What’s Past Is Prologue (S01, Ep13)","Television",2017,"USA","Drama",7.4,3.7,NA,"Star Trek: Discovery"
"sqs101800121m4","The War Without, the War Within (S01, Ep14)","Television",2017,"USA","Drama",7.4,3.7,NA,"Star Trek: Discovery"
"sqs101800122m4","Will You Take My Hand? (S01, Ep15)","Television",2017,"USA","Drama",7.4,3.7,NA,"Star Trek: Discovery"
"sqs101800123m4","Journey Into Night (Ep1)","Television",2018,"USA","Drama",9.1,4.6,NA,"Westworld S02"
"sqs101800124m4","Reunion (Ep2)","Television",2018,"USA","Drama",9.1,4.6,NA,"Westworld S02"
"sqs101800125m4","Virtu E Fortuna (Ep3)","Television",2018,"USA","Drama",9.1,4.6,NA,"Westworld S02"
"sqs101800126m4","The Riddle Of The Sphinx (Ep4)","Television",2018,"USA","Drama",9.1,4.6,NA,"Westworld S02"
"sqs101800127m4","Akane No Mai (Ep5)","Television",2018,"USA","Drama",9.1,4.6,NA,"Westworld S02"
"sqs101800128m4","Phase Space (Ep6)","Television",2018,"USA","Drama",9.1,4.6,NA,"Westworld S02"
"sqs101800129m4","Les Escorches (Ep7)","Television",2018,"USA","Drama",9.1,4.6,NA,"Westworld S02"
"sqs101800130m4","Kiksuya (Ep8)","Television",2018,"USA","Drama",9.1,4.6,NA,"Westworld S02"
"sqs101800131m4","Vanishing Point (Ep9)","Television",2018,"USA","Drama",9.1,4.6,NA,"Westworld S02"
"sqs101800132m4","The Passenger (Ep10)","Television",2018,"USA","Drama",9.1,4.6,NA,"Westworld S02"
"sqs101800133m4","Sliding in Snow, Sailing the Sea… (Ep11-15)","Television",2017,"USA","Family",0,3.6,NA,"Billy BamBam"
"sqs101800134m4","Charlie Meets M, N, O, P, Q, R (Ep13-18)","Television",2017,"USA","Family",0,3.5,NA,"Charlie & the Alphabet"
"sqs101800135m4","Three-Legged Race (Ep7)","Television",2017,"USA","Animation",8.2,4.1,NA,"Disney Mickey Mouse S04"
"sqs101800136m4","Nature's Wonderland (Ep8)","Television",2017,"USA","Animation",8.2,4.1,NA,"Disney Mickey Mouse S04"
"sqs101800137m4","Firefly Parade (Ep31)","Television",2017,"USA","Animation",0,3.5,NA,"Disney Tsum Tsum S03"
"sqs101800138m4","Origami Zoo (Ep32)","Television",2017,"USA","Animation",0,3.5,NA,"Disney Tsum Tsum S03"
"sqs101800139m4","Three Jaquins and a Princess (Ep4)","Television",2017,"USA","Animation",6.7,3.4,NA,"Elena of Avalor S02"
"sqs101800140m4","A Spy in the Palace (Ep5)","Television",2017,"USA","Animation",6.7,3.4,NA,"Elena of Avalor S02"
"sqs101800141m4","Free Bird (Ep4)","Television",2017,"USA","Animation",7.6,3.8,NA,"Marvel's Guardians of the Galaxy S02"
"sqs101800142m4","Sandman (Ep6)","Television",2017,"USA","Family",6.8,3.4,NA,"Marvel's Spider-Man"
"sqs101800143m4","Ye Olde Royal Heist / Tea Time Trouble! (Ep7)","Television",2017,"USA","Animation",7.3,3.7,NA,"Mickey and the Roadster Races"
"sqs101800144m4","Abra-ka-Goof! / Happy Birthday Helpers! (Ep8)","Television",2017,"USA","Animation",7.3,3.7,NA,"Mickey and the Roadster Races"
"sqs101800145m4","Forever Filly (Ep6)","Television",2017,"USA","Animation",7.7,3.9,NA,"My Little Pony Friendship is Magic S07"
"sqs101800146m4","Proud To Be A Coal Miner's Wabbit / Cabin…(Ep8)","Television",2015,"USA","Animation",5.8,2.9,NA,"New Looney Tunes S02"
"sqs101800147m4","Owl, Tree, Cement Truck, Clown, Giraffe, Truck (Ep13-18)","Television",2017,"USA","Family",0,3.6,NA,"Pierre the Painter"
"sqs101800148m4","Ep 5, 6, 7, 8","Television",2014,"KOR","Animation",6.2,3.1,NA,"Pororo the Little Penguin S02"
"sqs101800149m4","Pigs and Pugs / Bob Loves Mona (Ep8)","Television",2017,"USA","Animation",7,3.5,NA,"Puppy Dog Pals"
"sqs101800150m4","Don't Rain on My Pug-rade / Their Royal Pug-ness (Ep9)","Television",2017,"USA","Animation",7,3.5,NA,"Puppy Dog Pals"
"sqs101800151m4","Mutiny on the Krusty / The Whole Tooth","Television",2012,"USA","Animation",8.1,4,NA,"Spongebob Squarepants S09"
"sqs101800152m4","Demoncism / Sophomore Slump (Ep7)","Television",2017,"USA","Animation",8.2,4.1,NA,"Star vs. the Forces of Evil S03"
"sqs101800153m4","Lint Catcher / Trial by Squire (Ep8)","Television",2017,"USA","Animation",8.2,4.1,NA,"Star vs. the Forces of Evil S03"
"sqs101800154m4","In the Name of the Rebellion: Part One (Ep3)","Television",2016,"USA","Animation",8,4,NA,"Star Wars Rebels S04"
"sqs101800155m4","In the Name of the Rebellion: Part Two (Ep4)","Television",2016,"USA","Animation",8,4,NA,"Star Wars Rebels S04"
"sqs101800156m4","Stuck with a Boy Genius (Ep9)","Television",2017,"USA","Animation",5.9,3,NA,"Stuck in the Middle S02"
"sqs101800157m4","Stuck with a Bad Influence (Ep10)","Television",2017,"USA","Family",5.9,3,NA,"Stuck in the Middle S02"
"sqs101800158m4","S01 Ep 3-4 Super Wings","Television",2015,"CHN","Animation",6.7,3.4,NA,"Super Wings"
"sqs101800159m4","Bats What I Like About The South/ Fraidy... (S01, Ep2)","Television",2007,"USA","Animation",7.3,3.7,NA,"Tom and Jerry Tales"
"sqs101800160m4","Rock Friend / Crushing Defeat (Ep2)","Television",2018,"USA","Animation",6.1,3.1,NA,"Unikitty!"
"sqs101800161m4","Ep 1 The Trading Floor","Television",2018,"HKG","Drama",7.2,3.6,NA,"The Trading Floor 東方華爾街"
"sqs101800162m4","Ep 2 The Trading Floor","Television",2018,"HKG","Drama",7.2,3.6,NA,"The Trading Floor 東方華爾街"
"sqs101800163m4","Ep 3 The Trading Floor","Television",2018,"HKG","Drama",7.2,3.6,NA,"The Trading Floor 東方華爾街"
"sqs101800164m4","Ep 4 The Trading Floor","Television",2018,"HKG","Drama",7.2,3.6,NA,"The Trading Floor 東方華爾街"
"sqs101800165m4","Ep 5 The Trading Floor","Television",2018,"HKG","Drama",7.2,3.6,NA,"The Trading Floor 東方華爾街"
"sqs101800166m4","Ep 1 Legend of Fuyao","Television",2018,"CHN","Drama",0,3.9,NA,"Legend of Fuyao 扶摇"
"sqs101800167m4","Ep 2 Legend of Fuyao","Television",2018,"CHN","Drama",0,3.9,NA,"Legend of Fuyao 扶摇"
"sqs101800168m4","Ep 3 Legend of Fuyao","Television",2018,"CHN","Drama",0,3.9,NA,"Legend of Fuyao 扶摇"
"sqs101800169m4","Ep 4 Legend of Fuyao","Television",2018,"CHN","Drama",0,3.9,NA,"Legend of Fuyao 扶摇"
"sqs101800170m4","Ep 5 Legend of Fuyao","Television",2018,"CHN","Drama",0,3.9,NA,"Legend of Fuyao 扶摇"
"sqs101800171m4","Ep 6 Legend of Fuyao","Television",2018,"CHN","Drama",0,3.9,NA,"Legend of Fuyao 扶摇"
"sqs101800172m4","Ep 7 Legend of Fuyao","Television",2018,"CHN","Drama",0,3.9,NA,"Legend of Fuyao 扶摇"
"sqs101800173m4","Ep 8 Legend of Fuyao","Television",2018,"CHN","Drama",0,3.9,NA,"Legend of Fuyao 扶摇"
"sqs101800175m4","Ep 10 Legend of Fuyao","Television",2018,"CHN","Drama",0,3.9,NA,"Legend of Fuyao 扶摇"
"sqs101800176m4","Ep 11 Legend of Fuyao","Television",2018,"CHN","Drama",0,3.9,NA,"Legend of Fuyao 扶摇"
"sqs101800177m4","Ep 12 Legend of Fuyao","Television",2018,"CHN","Drama",0,3.9,NA,"Legend of Fuyao 扶摇"
"sqs101800178m4","Ep 13 Legend of Fuyao","Television",2018,"CHN","Drama",0,3.9,NA,"Legend of Fuyao 扶摇"
"sqs101800179m4","Ep 14 Legend of Fuyao","Television",2018,"CHN","Drama",0,3.9,NA,"Legend of Fuyao 扶摇"
"sqs101800180m4","Ep 15 Legend of Fuyao","Television",2018,"CHN","Drama",0,3.9,NA,"Legend of Fuyao 扶摇"
"sqs101800181m4","Ep 16 Legend of Fuyao","Television",2018,"CHN","Drama",0,3.9,NA,"Legend of Fuyao 扶摇"
"sqs101800182m4","Ep 17 Legend of Fuyao","Television",2018,"CHN","Drama",0,3.9,NA,"Legend of Fuyao 扶摇"
"sqs101800183m4","Ep 18 Legend of Fuyao","Television",2018,"CHN","Drama",0,3.9,NA,"Legend of Fuyao 扶摇"
"sqs101800184m4","Ep 19 Legend of Fuyao","Television",2018,"CHN","Drama",0,3.9,NA,"Legend of Fuyao 扶摇"
"sqs101800185m4","Ep 20 Legend of Fuyao","Television",2018,"CHN","Drama",0,3.9,NA,"Legend of Fuyao 扶摇"
"sqs101800186m4","Ep 9 Ace vs. Ace","Television",2016,"CHN","Variety & Game Shows",0,3.2,NA,"Ace vs Ace 2 王牌对王牌 第二季"
"sqs101800187m4","Ep 1 Singer 2018","Television",2017,"CHN","Arts, Music & Culture",0,3.9,NA,"Singer 2018 歌手2018"
"sqs101800188m4","Ep 2 Singer 2018","Television",2017,"CHN","Arts, Music & Culture",0,3.9,NA,"Singer 2018 歌手2018"
"sqs101800189m4","Ep 3 Singer 2018","Television",2017,"CHN","Arts, Music & Culture",0,3.9,NA,"Singer 2018 歌手2018"
"sqs101800190m4","Andre Chiang, SNH48 (Ep1)","Television",2017,"CHN","Travel",0,3.4,NA,"Chef Nic S04"
"sqs101800191m4","Wong Cho-lam, Leanne Li (Ep2)","Television",2017,"CHN","Travel",0,3.4,NA,"Chef Nic S04"
"sqs101800192m4","Jackson Wang (Ep3)","Television",2017,"CHN","Travel",0,3.4,NA,"Chef Nic S04"
"sqs101800193m4","A War-stricken Kingdom in the Forests (Ep4)","Television",2017,"CHN","Documentary",0,4.3,NA,"The Great Shokunin S02 《了不起的匠人》第二季"
"sqs101800194m4","The Huafu Dream of a Hong Konger (Ep5)","Television",2017,"CHN","Documentary",0,4.3,NA,"The Great Shokunin S02 《了不起的匠人》第二季"
"sqs101800195m4","The Survival of Teng Paper Master (Ep6)","Television",2017,"CHN","Documentary",0,4.3,NA,"The Great Shokunin S02 《了不起的匠人》第二季"
"sqs101800196m4","Peter Ho & Peggy","Television",2018,"TWN","Lifestyle",0,3.7,NA,"The SS Show 小燕有約"
"sqs101800197m4","Stammering Ballad 黃河尕謠","Television",2018,"CHN","Arts, Music & Culture",0,4.1,NA,"Stammering Ballad 黃河尕謠"
"sqs101800198m4","Locked Room Case of the Blog Actress Part 1","Television",2017,"JPN","Animation",8.4,4.2,NA,"Detective Conan 名探偵コナン"
"sqs101800199m4","The Actress Blogger’s Locked Room Case Part 2","Television",2017,"JPN","Animation",8.4,4.2,NA,"Detective Conan 名探偵コナン"
"sqs101800200m4","Ep 1 Hungry Hopper","Television",2017,"JPN","Travel",0,3.1,NA,"Hungry Hopper"
"sqs101800201m4","Ep 10 Wakako-Zake","Television",2016,"JPN","Drama",0,3.8,NA,"Wakako-Zake 和歌子酒"
"sqs101800202m4","Hariharan & Lesle Lewis (Ep126)","Television",2017,"IND","Comedy",8.6,4.3,NA,"The Kapil Sharma Show"
"sqs101800203m4","Ep 6 Astronauts","Television",2017,"GBR","Science & Tech",8.4,4.2,NA,"Astronauts: Toughest Job in the Universe"
"sqs101800204m4","Down in Flames (Ep3)","Television",2017,"USA","Reality",8,4,NA,"Deadliest Catch S13"
"sqs101800206m4","Bromance On the Road (Ep1)","Television",2017,"IND","Travel",0,4,NA,"Great Escape with Kunal & Cyrus"
"sqs101800207m4","Komodo Dragons","Television",2018,"USA","Nature & the Environment",0,4,NA,"Komodo Dragons"
"sqs101800208m4","Ep 1 Meanwhile in Australia","Television",2018,"AUS","Travel",0,4,NA,"Meanwhile in Australia with Nick Cummins"
"sqs101800209m4","Nothing Like a Dame","Television",2018,"GBR","Documentary",7.6,3.8,NA,"Nothing Like a Dame"
"sqs101800218m4","Portraits of Marie Antoinette","Television",2017,"FRA","History",0,4,NA,"Portraits of Marie Antoinette"
"sqs101800219m4","Jungle Sacrifice (Ep1)","Television",2017,"USA","Adventure",8.6,4.3,NA,"Primal Survivor S02"
"sqs101800220m4","Ep 1 Route Awakening","Television",2017,"CHN","Travel",0,3.5,NA,"Route Awakening S03"
"sqs101800221m4","Ep 3 Science of Stupid","Television",2017,"GBR","Science & Tech",7,3.5,NA,"Science of Stupid S05"
"sqs101800222m4","Doomsday Volcano Mystery (Ep4)","Television",2017,"USA","History",7,3.5,NA,"Secrets of the Underground S02"
"sqs101800223m4","Sub Zero Porsche (Ep6)","Television",2017,"GBR","Reality",0,3.9,NA,"Supercar Megabuild S02"
"sqs101800224m4","Symphony for Our World","Television",2018,"USA","Arts, Music & Culture",0,4,NA,"Symphony for Our World"
"sqs101800225m4","Ricky Tomlinson","Television",2017,"GBR","History",8,4,NA,"Who Do You Think You Are UK S13"
"sqs101800226m4","Ends of the Earth (Ep1)","Television",2018,"USA","Nature & the Environment",0,4,NA,"Wild Chile"
"sqs101800227m4","Land Before Time (Ep2)","Television",2018,"USA","Nature & the Environment",0,4,NA,"Wild Chile"
"sqs101800228m4","Life Without Water (Ep3)","Television",2018,"USA","Nature & the Environment",0,4,NA,"Wild Chile"
"sqs101800229m4","La Fiesta (Ep11)","Television",2016,"USA","Food",7.9,4,NA,"Avec Eric S03"
"sqs101800230m4","Modernist Masters (Ep3)","Television",2016,"USA","Food",7.8,3.9,NA,"Eat the World with Emeril Lagasse"
"sqs101800231m4","Sauces (Ep5)","Television",2017,"GBR","Infotainment",8.3,4.2,NA,"Inside the Factory S03"
"sqs101800232m4","Ep 3 Nigella: At My Table","Television",2017,"GBR","Food",7.5,3.8,NA,"Nigella: At My Table"
"sqs101800233m4","Bundaberg (Ep11)","Television",2016,"AUS","Food",0,3.9,NA,"Surfing the Menu: The Next Generation"
"sqs101800235m4","Little Tools, Big Challenge (Ep4)","Television",2017,"USA","Reality",7.6,3.8,NA,"Top Chef S15"
"sqs101800236m4","This Is Not Glamping (Ep5)","Television",2017,"USA","Reality",7.6,3.8,NA,"Top Chef S15"
"sqs101800237m4","Now That's A Lot Of Schnitzel (Ep6)","Television",2017,"USA","Reality",7.6,3.8,NA,"Top Chef S15"
"sqs101800238m4","Bras (Ep2)","Television",2014,"GBR","Infotainment",0,4,NA,"World's Best Chefs"
"sqs101800242m4","Hanoi (Ep1)","Television",2015,"USA","Travel",8.6,4.3,NA,"Anthony Bourdain: Parts Unknown S08"
"sqs101800243m4","Super Senses (Ep5)","Television",2016,"USA","Variety & Game Shows",8.5,4.3,NA,"Brain Games S07"
"sqs101800244m4","A Whole New Ball Game (Ep3)","Television",2017,"USA","Reality",6.6,3.3,NA,"Cesar Millan's Dog Nation"
"sqs101800245m4","Bert Kreischer/Taryn Manning/Hal Sparks (Ep5)","Television",2017,"USA","Variety & Game Shows",5.8,2.9,NA,"The Comedy Jam"
"sqs101800246m4","Low-Impact House, Pembrokeshire (Ep6)","Television",2016,"GBR","Infotainment",8.6,4.3,NA,"Grand Designs S14"
"sqs101800247m4","Guyana / London (Ep3)","Television",2017,"GBR","Action & Adventure",8.8,4.4,NA,"The Life Swap Adventure"
"sqs101800248m4","Thor God of Blubber (Ep3)","Television",2017,"USA","Reality",7.8,3.9,NA,"My Big Fat Pet Makeover"
"sqs101800250m4","Vanessa Hudgens (Ep10)","Television",2017,"USA","Action & Adventure",7.9,4,NA,"Running Wild with Bear Grylls S03"
"sqs101800251m4","Liyanna, Shaheera and Nina (Ep4)","Television",2017,"SGP","Reality",0,4.1,NA,"Say Yes to the Dress: Asia"
"sqs101800271m4","Healthy Travel Tips from Canyon Ranch®","Television",2018,"SGP","Infotainment",0,4,NA,"Healthy Travel Tips from Canyon Ranch®"
"sqs101800272m4","Stretch & Energize with Canyon Ranch®","Television",2018,"SGP","Infotainment",0,4,NA,"Stretch & Energize with Canyon Ranch®"
"sqs101800253m4","Healing Plants (Ep1)","Television",2018,"CAN","Infotainment",0,4.1,NA,"Ageless Gardens"
"sqs101800254m4","Awake: The Secrets of Sleep","Television",2018,"IRL","Infotainment",0,4.1,NA,"Awake: The Secrets of Sleep"
"sqs101800257m4","Ep 9 Million Dollar Car Hunters","Television",2017,"GBR","Infotainment",0,3.6,NA,"Million Dollar Car Hunters"
"sqs101800258m4","Malibu Castle & Drinks with Mr. Wonderful (Ep1)","Television",2018,"USA","Infotainment",5.9,3,NA,"Secret Lives of the Super Rich S07"
"sqs101800259m4","Portugal (Ep1)","Television",2018,"USA","Infotainment",7.5,3.8,NA,"World's Most Extraordinary Homes S02"
"sqs101800260m4","Switzerland (Ep2)","Television",2018,"USA","Infotainment",7.5,3.8,NA,"World's Most Extraordinary Homes S02"
"sqs101800261m4","Ep 2 Being Serena","Television",2018,"USA","Infotainment",6.1,3.1,NA,"Being Serena"
"sqs101800262m4","Glenn McGrath","Television",2015,"GBR","Infotainment",0,3.5,NA,"Cricket's Greatest"
"sqs101800265m4","Premier League Review of the Season 2017/18","Television",2018,"GBR","Sports",0,4,NA,"Premier League Review of the Season 2017/18"
"sqs101800266m4","Sounds of the NBA Finals 2018","Television",2018,"GBR","Sports",0,4,NA,"Sounds of the NBA Finals 2018"
"sqs101800267m4","Nokia Mobile: We Were Connecting People (Nokia Mobile - Matkapuhelimen tarina)","Television",2017,"FIN","Business",7.1,3.6,NA,"Nokia Mobile: We Were Connecting People (Nokia Mobile - Matkapuhelimen tarina)"
"sqs101800268m4","Eddie Thai (Ep8)","Television",2017,"SGP","Business",0,3.4,NA,"PowerList Asia S06"
"sqs101800269m4","Korea (Ep10)","Television",2017,"SGP","Food Culture",0,3.4,NA,"National Flavours 民族味"
"sqs101800270m4","Afghan At Last (Ep3)","Television",2018,"SGP","Food Culture",0,3.8,NA,"Refugee Chef"
"sqs111800001m4","Closer (Ep5)","Television",2018,"USA","Drama",8.5,4.3,NA,"Sharp Objects"
"sqs111800002m4","Cherry (Ep6)","Television",2018,"USA","Drama",8.5,4.3,NA,"Sharp Objects"
"sqs111800003m4","Falling (Ep7)","Television",2018,"USA","Drama",8.5,4.3,NA,"Sharp Objects"
"sqs111800004m4","Milk (Ep8)","Television",2018,"USA","Drama",8.5,4.3,NA,"Sharp Objects"
"sqs111800005m4","How to Fire a Rifle Without Really Trying (Ep1)","Television",1997,"USA","Comedy",7.3,3.7,NA,"King of the Hill S02"
"sqs111800006m4","Hilloween (Ep6)","Television",1997,"USA","Comedy",7.3,3.7,NA,"King of the Hill S02"
"sqs111800007m4","The Son That Got Away (Ep8)","Television",1997,"USA","Comedy",7.3,3.7,NA,"King of the Hill S02"
"sqs111800008m4","Emancipation (Ep2)","Television",2000,"USA","Comedy",8,4,NA,"Malcolm in the Middle S03"
"sqs111800009m4","Reese Drives (Ep9)","Television",2000,"USA","Comedy",8,4,NA,"Malcolm in the Middle S03"
"sqs111800010m4","Hal Coaches (Ep16)","Television",2000,"USA","Comedy",8,4,NA,"Malcolm in the Middle S03"
"sqs111800024m4","Sleep Tight, Puddin' Pop (Ep7)","Television",2005,"USA","Comedy",7.1,3.6,NA,"Two and a Half Men S03"
"sqs111800025m4","That Voodoo That I Do Do (Ep8)","Television",2005,"USA","Comedy",7.1,3.6,NA,"Two and a Half Men S03"
"sqs111800026m4","Madame And Her Special Friend (Ep9)","Television",2005,"USA","Comedy",7.1,3.6,NA,"Two and a Half Men S03"
"sqs111800027m4","Phil (Ep5)","Television",2017,"USA","Comedy",7.5,3.8,NA,"Better Things S02"
"sqs111800028m4","Eulogy (Ep6)","Television",2017,"USA","Comedy",7.5,3.8,NA,"Better Things S02"
"sqs111800029m4","Blackout (Ep7)","Television",2017,"USA","Comedy",7.5,3.8,NA,"Better Things S02"
"sqs111800030m4","Arnold Hall (Ep8)","Television",2017,"USA","Comedy",7.5,3.8,NA,"Better Things S02"
"sqs111800031m4","Thanks-Hoarding (Ep5)","Television",2017,"USA","Comedy",8.1,4.1,NA,"Bob's Burgers S08"
"sqs111800032m4","The Bleakening - Part One (Ep6)","Television",2017,"USA","Comedy",8.1,4.1,NA,"Bob's Burgers S08"
"sqs111800033m4","The Bleakening - Part Two (Ep7)","Television",2017,"USA","Comedy",8.1,4.1,NA,"Bob's Burgers S08"
"sqs111800034m4","V for Valentine-Detta (Ep8)","Television",2017,"USA","Comedy",8.1,4.1,NA,"Bob's Burgers S08"
"sqs111800035m4","It's the Great Pumpkin, Phil Dunphy (Ep5)","Television",2017,"USA","Comedy",8.5,4.3,NA,"Modern Family S09"
"sqs111800036m4","Ten Years Later (Ep6)","Television",2017,"USA","Comedy",8.5,4.3,NA,"Modern Family S09"
"sqs111800037m4","Winner Winner Turkey Dinner (Ep7)","Television",2017,"USA","Comedy",8.5,4.3,NA,"Modern Family S09"
"sqs111800038m4","Brushes with Celebrity (Ep8)","Television",2017,"USA","Comedy",8.5,4.3,NA,"Modern Family S09"
"sqs111800039m4","Pilot - Red Oaks (S01, Ep1)","Television",2015,"USA","Comedy",7.9,4,NA,"Red Oaks"
"sqs111800040m4","Doubles (S01, Ep2)","Television",2015,"USA","Comedy",7.9,4,NA,"Red Oaks"
"sqs111800041m4","The Wedding (S01, Ep3)","Television",2015,"USA","Comedy",7.9,4,NA,"Red Oaks"
"sqs111800042m4","MDMA (S01, Ep4)","Television",2015,"USA","Comedy",7.9,4,NA,"Red Oaks"
"sqs111800043m4","Fourth of July (S01, Ep5)","Television",2015,"USA","Comedy",7.9,4,NA,"Red Oaks"
